{
  "$schema": "http://json-schema.org/draft-07/schema#",
  "$id": "mavibelge://schema/manifest-envelope.schema.json",
  "title": "Mavi Belge Faz 6A Manifest Zarfı",
  "description": "wordpress-site/data/content/*.manifest.json ve wordpress-site/data/mapping/*.manifest.json dosyalarının ortak üst-seviye şekli. 'records' veya 'rows' anahtarının hangisi kullanıldığı dosyaya göre değişir (content/mapping/unmatched-fees: 'records'; mapping: 'rows').",
  "type": "object",
  "required": ["schema_version", "record_type", "count"],
  "properties": {
    "schema_version": { "type": "string", "const": "2.0.0" },
    "record_type": { "type": "string", "enum": ["sector", "qualification", "fee", "news", "reference", "mapping", "unmatched_fee"] },
    "count": { "type": "integer", "minimum": 0 },
    "counts": { "type": "object", "description": "Yalnız fees.manifest.json'da: sayım özeti (priceOptionsTotal, pricingSingle, pricingMulti, multiOptionsTotal, feesWithCode, feesWithoutCode, linkedCount)." },
    "notes": { "type": "array", "items": { "type": "string" } },
    "source": {
      "type": "object",
      "properties": {
        "file": { "type": "string" },
        "sha256": { "type": "string", "pattern": "^[0-9a-f]{64}$" }
      }
    },
    "records": {
      "type": "array",
      "description": "sector/qualification/fee/unmatched_fee için: bkz. ilgili *.schema.json dosyası."
    },
    "rows": {
      "type": "array",
      "description": "yalnız mapping.manifest.json için: her elemanın tam şekli mapping-row.schema.json'dadır (mini-schema.js $ref desteklemediği için burada yinelenmez; verify-manifest.js her satırı AYRICA mapping-row.schema.json'a karşı da doğrular).",
      "items": { "type": "object" }
    }
  }
}
