{
  "schema_version": "2.0.0",
  "record_type": "news",
  "count": 6,
  "source": {
    "file": "tanitim-site/assets/data/news.js",
    "sha256": "1e5abd9eba5719b6e831067ba2f8b7bb2d3aeaabfe09d6b27741404f3d0309ac"
  },
  "notes": [
    "news.js: 6 gerçek haber/duyuru (başlık ve tarihler gerçektir). Kaynaktaki image alanı AKTARILMAZ (yazıya özel fotoğraf yoktur; ek eşlemesi bu fazda yok). İçe aktarılan haber taslak + in_review yazılır, asla yayınlanmaz/onaylanmaz."
  ],
  "records": [
    {
      "schema_version": "2.0.0",
      "source_key": "news:mobilya-sektoru-belge-zorunlulugu",
      "source_index": 0,
      "slug": "mobilya-sektoru-belge-zorunlulugu",
      "title": "Mobilya Sektörü Belge Zorunluluğu",
      "published_on": "2022-12-29",
      "news_type": "haber",
      "summary": "Ahşap Mobilya İmalatçısı ve Mobilya Döşemecisi meslek mensuplarının 1 Ocak 2023 itibarıyla MYK mesleki yeterlilik belgesi alması zorunlu hale gelmiştir.",
      "body": "Mesleki Yeterlilik Kurumu (MYK) düzenlemeleri uyarınca, mobilya sektöründe çalışan Ahşap Mobilya İmalatçısı ve Mobilya Döşemecisi meslek mensuplarının 1 Ocak 2023 tarihinden itibaren MYK Mesleki Yeterlilik Belgesi'ne sahip olması zorunlu hale gelmiştir. Mavi Belge, bu kapsamda sınav ve belgelendirme hizmeti sunmaktadır.",
      "source": {
        "file": "tanitim-site/assets/data/news.js",
        "sha256": "1e5abd9eba5719b6e831067ba2f8b7bb2d3aeaabfe09d6b27741404f3d0309ac"
      }
    },
    {
      "schema_version": "2.0.0",
      "source_key": "news:belge-ucretleri-hakkinda",
      "source_index": 1,
      "slug": "belge-ucretleri-hakkinda",
      "title": "Belge Ücretleri Hakkında",
      "published_on": "2022-12-29",
      "news_type": "duyuru",
      "summary": "Sınav ve belgelendirme ücret tarifesinde yapılan güncelleme hakkında duyuru. Güncel tarife için ücretler sayfasını inceleyiniz.",
      "body": "Mavi Belge sınav ve belgelendirme ücret tarifesi güncellenmiştir. Meslek bazlı güncel ücret bilgisi için lütfen Sınav Ücretleri sayfasını ziyaret ediniz veya kurumumuzla iletişime geçiniz.",
      "source": {
        "file": "tanitim-site/assets/data/news.js",
        "sha256": "1e5abd9eba5719b6e831067ba2f8b7bb2d3aeaabfe09d6b27741404f3d0309ac"
      }
    },
    {
      "schema_version": "2.0.0",
      "source_key": "news:bilgilendirme-subat-2023",
      "source_index": 2,
      "slug": "bilgilendirme-subat-2023",
      "title": "Bilgilendirme",
      "published_on": "2023-02-21",
      "news_type": "haber",
      "summary": "Adaylarımıza ve kurumsal iş ortaklarımıza yönelik genel süreç bilgilendirmesi.",
      "body": "Kurumumuz, adaylarını ve kurumsal iş ortaklarını sınav ve belgelendirme süreçleri hakkında düzenli olarak bilgilendirmeye devam etmektedir. Güncel duyurular için bu sayfayı takip edebilirsiniz.",
      "source": {
        "file": "tanitim-site/assets/data/news.js",
        "sha256": "1e5abd9eba5719b6e831067ba2f8b7bb2d3aeaabfe09d6b27741404f3d0309ac"
      }
    },
    {
      "schema_version": "2.0.0",
      "source_key": "news:myk-belgesi-zorunlulugu-yeni-meslekler-2021",
      "source_index": 3,
      "slug": "myk-belgesi-zorunlulugu-yeni-meslekler-2021",
      "title": "MYK Belgesi Zorunluluğu Getirilen Yeni Meslekler",
      "published_on": "2021-04-09",
      "news_type": "duyuru",
      "summary": "Çalışma ve Sosyal Güvenlik Bakanlığı tebliğleri kapsamında MYK belgesi zorunluluğu getirilen yeni mesleklere ilişkin duyuru.",
      "body": "Çalışma ve Sosyal Güvenlik Bakanlığı tarafından yayımlanan tebliğler doğrultusunda, belirli mesleklerde çalışanların MYK Mesleki Yeterlilik Belgesi'ne sahip olması zorunlu hale getirilmiştir. Detaylı bilgi için Mevzuat sayfasını inceleyebilirsiniz.",
      "source": {
        "file": "tanitim-site/assets/data/news.js",
        "sha256": "1e5abd9eba5719b6e831067ba2f8b7bb2d3aeaabfe09d6b27741404f3d0309ac"
      }
    },
    {
      "schema_version": "2.0.0",
      "source_key": "news:6-dilde-myk-belgesi-gecerliligi",
      "source_index": 4,
      "slug": "6-dilde-myk-belgesi-gecerliligi",
      "title": "6 Dilde MYK Belgesi Geçerliliği",
      "published_on": "2020-09-28",
      "news_type": "haber",
      "summary": "MYK Mesleki Yeterlilik Belgeleri'nin 6 dilde düzenlenerek uluslararası geçerlilik kazanması hakkında bilgilendirme.",
      "body": "MYK Mesleki Yeterlilik Belgeleri, sahiplerinin yurt dışında da mesleki yeterliliklerini kanıtlayabilmesi amacıyla 6 dilde düzenlenebilmektedir. Bu durum belgenin uluslararası alanda tanınırlığını artırmaktadır.",
      "source": {
        "file": "tanitim-site/assets/data/news.js",
        "sha256": "1e5abd9eba5719b6e831067ba2f8b7bb2d3aeaabfe09d6b27741404f3d0309ac"
      }
    },
    {
      "schema_version": "2.0.0",
      "source_key": "news:gecerlilik-suresi-dolan-belgelerin-yenilenmesi",
      "source_index": 5,
      "slug": "gecerlilik-suresi-dolan-belgelerin-yenilenmesi",
      "title": "Geçerlilik Süresi Dolan MYK Belgelerinin Yenilenmesi ve Gözetim İle İlgili Duyurular",
      "published_on": "2020-06-15",
      "news_type": "duyuru",
      "summary": "Geçerlilik süresi dolan MYK belgelerinin yenilenmesi ve gözetim süreçleri hakkında duyuru.",
      "body": "Geçerlilik süresi dolan MYK Mesleki Yeterlilik Belgeleri'nin yenilenmesi ve ara dönem gözetim süreçleri hakkında adaylarımızın Belge Yenileme sayfasını incelemesi ve gerekli işlemler için kurumumuzla iletişime geçmesi önerilir.",
      "source": {
        "file": "tanitim-site/assets/data/news.js",
        "sha256": "1e5abd9eba5719b6e831067ba2f8b7bb2d3aeaabfe09d6b27741404f3d0309ac"
      }
    }
  ]
}
